{
  "scenario_id": "relational-dimension-compiler-triage-2026-07-22",
  "scenario_scope": "Triage the Corben-authored Relational Dimension Compiler paper across immediate existing-chapter integration and a distinct future chapter boundary while the active roadmap freezes manifest admission.",
  "case_validity_state": "reviewed",
  "cases": [
    {
      "case_id": "rdc-existing-owner-integration",
      "intake_kind": "new_source",
      "access_state": "source_note_available",
      "source_storage_policy": "repo_public_note_only",
      "public_safety_state": "public_safe",
      "deduplication_state": "overlaps_existing_chapter",
      "candidate_decision": "update_existing_chapter",
      "chapter_manifest_action": "add_source_to_existing_chapter",
      "existing_chapter_id": "cognitive-compilation-and-semantic-ir; governed-world-models-and-reality-grounding; routing-heads-and-specialist-cores; replaceable-cognitive-substrates-beyond-transformer-monoculture; procedural-memory-and-cognitive-loop-closure; benchmark-ratchets-and-anti-goodhart-evidence; resource-economics-and-token-budgets; integrated-reference-architecture; open-research-agenda-and-bibliography-plan",
      "proposed_chapter_id": "not_applicable",
      "decision_rationale": "Dimensional typing, relational-order routing, relation reification, branch-local state, reversible contraction, compiled specialists, and total-cost evaluation materially improve existing owner interfaces even before a dedicated chapter can be adjudicated.",
      "required_before_drafting": [
        "completed full paper reading",
        "completed public-safe source note",
        "completed owner-boundary crosswalk",
        "preserve argument-only support and explicit nonclaims"
      ],
      "evidence_transition_preconditions": [
        "claim-specific implementation and matched evaluation",
        "strong lower-order rescue",
        "independent evaluator",
        "accepted evidence transition"
      ],
      "promotion_blockers": [
        "architecture paper only",
        "no RDC or RODIE implementation",
        "no external source result reproduced"
      ],
      "non_claims": [
        "does not make any existing chapter the full RDC owner",
        "does not promote support"
      ]
    },
    {
      "case_id": "rdc-distinct-future-owner",
      "intake_kind": "new_source",
      "access_state": "source_note_available",
      "source_storage_policy": "repo_public_note_only",
      "public_safety_state": "public_safe",
      "deduplication_state": "unique_boundary",
      "candidate_decision": "propose_new_chapter",
      "chapter_manifest_action": "defer_to_backlog",
      "existing_chapter_id": "none_owns_full_relational_topology_lifecycle",
      "proposed_chapter_id": "relational-dimension-compilation-and-polyadic-cognition",
      "decision_rationale": "The conjunction of dimensional typing, semantic/computational/storage arity, persistent role-sensitive relation objects, relation qualification lifecycle, adaptive order, reversible semantic contraction, and RODIE has a distinct interface, invariant set, artifact family, failure taxonomy, and future source program. Active roadmap rules nevertheless prohibit a chapter path or manifest decision now.",
      "required_before_drafting": [
        "structural-resume gate terminal",
        "source-by-source external bibliography verification",
        "birth-complete atom and reader packets",
        "W3 inheritance and adjacency checks",
        "formal ceiling and RODIE protocol frozen"
      ],
      "evidence_transition_preconditions": [
        "chapter admission remains argument-only",
        "later empirical movement requires matched RODIE or natural-task evidence",
        "no source inheritance to chapter-core support"
      ],
      "promotion_blockers": [
        "new-chapter freeze",
        "P2 and Round 16 resume gates incomplete",
        "no implementation or empirical result"
      ],
      "non_claims": [
        "does not reserve chapter order or guarantee admission",
        "does not create a chapter file, manifest row, proof target, or reader insertion"
      ]
    }
  ],
  "validation_boundary": "Records a passage-reviewed source integration and a deferred unique chapter candidate. It validates neither the RDC architecture nor its cited literature, representational propositions beyond their stated finite construction, benchmark feasibility, total-system advantage, or support movement.",
  "support_state_effect": "backlog_only",
  "non_claims": [
    "does not change chapter count or order",
    "does not authorize protected empirical work",
    "does not authorize release, deployment, or publication"
  ]
}
