{
  "scenario_id": "full-coverage-gap-audit-triage-2026-07-25",
  "scenario_scope": "Coordinated primary-source and manuscript-ownership triage for relational topology compilation, confidential and verifiable AI computation, human-AI symbiosis and neurotechnology, military AI and strategic stability, theoretical limits, non-silicon compute, post-quantum migration, co-adaptation, competition and liability, and multilingual/cultural coverage.",
  "case_validity_state": "accepted",
  "cases": [
    {
      "case_id": "relational-dimension-distinct-owner",
      "intake_kind": "new_source",
      "access_state": "source_note_available",
      "source_storage_policy": "repo_public_note_only",
      "public_safety_state": "public_safe",
      "deduplication_state": "unique_boundary",
      "candidate_decision": "propose_new_chapter",
      "chapter_manifest_action": "propose_manifest_chapter",
      "existing_chapter_id": "multiple_adjacent_owners",
      "proposed_chapter_id": "relational-dimension-compilation-and-polyadic-cognition",
      "decision_rationale": "No existing chapter owns the joined lifecycle from dimensional typing and candidate topology through role-preserving relation persistence, qualification, adaptive order, reversible contraction, slow-path compilation, and RODIE evaluation.",
      "required_before_drafting": ["completed paper reading", "completed source note", "completed owner-boundary audit", "argument-only support boundary"],
      "evidence_transition_preconditions": ["strong lower-order rescues", "complete proposal denominator", "held-out topology and role evaluation", "independent evaluator"],
      "promotion_blockers": ["no implemented RDC", "no RODIE corpus or natural-task result", "no independent reproduction"],
      "non_claims": ["does not establish irreducible high-order structure", "does not prove bounded primitive arity sufficient"]
    },
    {
      "case_id": "confidential-verifiable-computation-distinct-owner",
      "intake_kind": "external_literature",
      "access_state": "source_note_available",
      "source_storage_policy": "external_url_only",
      "public_safety_state": "public_safe",
      "deduplication_state": "unique_boundary",
      "candidate_decision": "propose_new_chapter",
      "chapter_manifest_action": "propose_manifest_chapter",
      "existing_chapter_id": "privacy-data-rights-and-information-flow-governance",
      "proposed_chapter_id": "confidential-and-verifiable-ai-computation",
      "decision_rationale": "Privacy owns permitted information use and hardware custody owns artifact control; neither owns execution across distrust boundaries with explicit input privacy, model privacy, output integrity, computation correctness, attestation freshness, verifier policy, and cost.",
      "required_before_drafting": ["primary-source notes for NIST PEC, RATS, and zkLLM", "separate guarantee matrix", "explicit authorization non-claim"],
      "evidence_transition_preconditions": ["implemented mechanisms", "declared adversary and leakage model", "matched native baseline", "independent verification and cost measurement"],
      "promotion_blockers": ["no local FHE, MPC, TEE, or ZK inference", "source-reported performance only", "cryptographic proof scope is not semantic correctness"],
      "non_claims": ["does not prove end-to-end privacy", "does not make attested code trustworthy or authorized"]
    },
    {
      "case_id": "human-ai-symbiosis-distinct-owner",
      "intake_kind": "external_literature",
      "access_state": "source_note_available",
      "source_storage_policy": "external_url_only",
      "public_safety_state": "public_safe",
      "deduplication_state": "unique_boundary",
      "candidate_decision": "propose_new_chapter",
      "chapter_manifest_action": "propose_manifest_chapter",
      "existing_chapter_id": "human-factors-and-meaningful-control-in-oversight",
      "proposed_chapter_id": "human-ai-symbiosis-neurotechnology-and-cognitive-sovereignty",
      "decision_rationale": "Human Factors owns oversight performance; the new owner governs longitudinal bidirectional coupling in which cognitive state, neural data, adaptation, assistive dependence, stimulation, and identity-sensitive changes become part of the system.",
      "required_before_drafting": ["human-study and neurotechnology primary-source notes", "medical and enhancement boundary", "mental-integrity and neural-data rights boundary"],
      "evidence_transition_preconditions": ["ethics-approved longitudinal human study", "human-alone AI-alone and combination controls", "skill retention and dependence measures", "independent safety review"],
      "promotion_blockers": ["no local human or neural-interface study", "no medical or enhancement claim", "no universal human-AI synergy result"],
      "non_claims": ["does not establish beneficial symbiosis", "does not authorize neural data collection or stimulation"]
    },
    {
      "case_id": "military-strategic-stability-distinct-owner",
      "intake_kind": "external_literature",
      "access_state": "source_note_available",
      "source_storage_policy": "external_url_only",
      "public_safety_state": "public_safe",
      "deduplication_state": "unique_boundary",
      "candidate_decision": "propose_new_chapter",
      "chapter_manifest_action": "propose_manifest_chapter",
      "existing_chapter_id": "dangerous-capability-domains-and-misuse-uplift",
      "proposed_chapter_id": "military-ai-autonomous-weapons-and-strategic-stability",
      "decision_rationale": "Dangerous Capabilities owns actor uplift and misuse measurement. Military and nuclear systems require a separate interaction-level lifecycle for context-specific human judgment, command authority, target and effect constraints, adversary response, false alarms, crisis timing, escalation, proliferation, legal review, and fail-safe posture.",
      "required_before_drafting": ["ICRC and SIPRI primary-source notes", "information-hazard-safe prose", "legal and policy non-claim boundary"],
      "evidence_transition_preconditions": ["safe strategic simulation", "multiple doctrine and interaction assumptions", "false-positive and false-negative controls", "independent policy and technical evaluation"],
      "promotion_blockers": ["no operational weapon design or test", "no real crisis experiment", "no universal legal or strategic conclusion"],
      "non_claims": ["does not authorize weapons or targeting", "does not establish that any specific policy is stabilizing"]
    },
    {
      "case_id": "eight-section-existing-owner-integration",
      "intake_kind": "external_literature",
      "access_state": "source_note_available",
      "source_storage_policy": "external_url_only",
      "public_safety_state": "public_safe",
      "deduplication_state": "overlaps_existing_chapter",
      "candidate_decision": "update_existing_chapter",
      "chapter_manifest_action": "add_source_to_existing_chapter",
      "existing_chapter_id": "multiple_existing_owners",
      "proposed_chapter_id": "not_applicable",
      "decision_rationale": "No-free-lunch and identifiability qualify Learning Theory; neuromorphic, photonic, analog, quantum, and biohybrid systems qualify Replaceable Substrates and Physical Compute; post-quantum migration qualifies Security Kernel and Weight Custody; co-adaptation qualifies Human-AI Organizations; market concentration and liability qualify Deployment and Institutions; multilingual and cultural coverage qualify Communication and Benchmarks.",
      "required_before_drafting": ["primary-source note", "named mechanism and limitation", "failure mode", "explicit non-claim"],
      "evidence_transition_preconditions": ["claim-specific natural evaluation", "competent baseline", "independent evaluation", "accepted evidence transition"],
      "promotion_blockers": ["literature synthesis is not local evidence", "projected hardware or policy benefits are not reproduced"],
      "non_claims": ["does not create duplicate chapters", "does not promote any chapter core"]
    }
  ],
  "validation_boundary": "Records four distinct-owner admissions and eight existing-owner integrations after a full manifest and primary-source audit. It validates neither the new architectures nor their source-reported results, legal conclusions, military policy, human outcomes, cryptographic guarantees, or support movement.",
  "support_state_effect": "backlog_only",
  "non_claims": [
    "does not create empirical, formal, reproduced, deployed, legal, or SOTA support",
    "does not authorize hazardous or human-subject experimentation",
    "does not authorize external publication",
    "does not close the active empirical roadmap"
  ]
}
