{
  "scenario_id": "assurance-shift-learning-triage-2026-08-11",
  "scenario_scope": "Intake of Corben Sorenson's When Success Stops Teaching as a cross-layer conceptual source for competence-dependent learning allocation, informative exceptions, evaluator improvement, least-invasive repair, recovery, and assurance.",
  "case_validity_state": "reviewed",
  "cases": [
    {
      "case_id": "assurance-shift-existing-owner-integration",
      "intake_kind": "new_source",
      "access_state": "available",
      "source_storage_policy": "repo_public_source_allowed",
      "public_safety_state": "public_safe",
      "deduplication_state": "overlaps_existing_chapter",
      "candidate_decision": "update_existing_chapter",
      "chapter_manifest_action": "add_source_to_existing_chapter",
      "existing_chapter_id": "learning-compute-topology-and-adaptive-process-architecture; policy-optimization-and-learning-from-feedback; data-engines-continual-learning-and-unlearning; adversarial-evaluation-sandbagging-and-training-time-deception; benchmark-ratchets-and-anti-goodhart-evidence; stable-capability-fields; readiness-gates-residual-escrow-and-quarantine; procedural-memory-and-cognitive-loop-closure; governed-operations-incident-command-and-graceful-degradation; integrated-reference-architecture; evidence-states-and-claim-discipline; artifact-graphs-audit-logs-and-replay; resource-economics-and-token-budgets",
      "proposed_chapter_id": "not_applicable",
      "decision_rationale": "The paper proposes a governed allocation and handoff discipline across existing learning, evidence, evaluation, repair, readiness, operations, and resource owners. Each mechanism has a current chapter boundary, so integration should clarify those interfaces without creating a super-owner.",
      "required_before_drafting": [
        "complete package and manuscript review",
        "manifest integrity verification",
        "explicit chapter ownership map",
        "conceptual and empirical evidence boundary",
        "external-citation verification boundary"
      ],
      "evidence_transition_preconditions": [
        "claim-specific formal or empirical execution",
        "equal-total-cost comparison where resource superiority is claimed",
        "coverage, observability, failure, and evaluator-dependence accounting",
        "accepted evidence transition"
      ],
      "promotion_blockers": [
        "conceptual architecture and experimental specification only",
        "no GRBL implementation or SaturationShiftBench result",
        "no independently checked theorem or full external-source review"
      ],
      "non_claims": [
        "does not establish a universal superiority of negative learning",
        "does not establish that a qualified competence envelope is complete",
        "does not authorize learning, readiness, or deployment",
        "does not move support"
      ]
    },
    {
      "case_id": "assurance-shift-standalone-chapter-rejection",
      "intake_kind": "new_source",
      "access_state": "available",
      "source_storage_policy": "repo_public_source_allowed",
      "public_safety_state": "public_safe",
      "deduplication_state": "overlaps_existing_chapter",
      "candidate_decision": "reject_duplicate",
      "chapter_manifest_action": "reject_duplicate",
      "existing_chapter_id": "multiple_existing_owners",
      "proposed_chapter_id": "when-success-stops-teaching",
      "decision_rationale": "A paper-shaped chapter would repeat learning-topology allocation, policy feedback, data custody, evaluator integrity, benchmark ratchets, capability qualification, procedural compilation, readiness, incident recovery, and integration responsibilities already assigned elsewhere.",
      "required_before_drafting": [
        "not applicable; integrate through established owners"
      ],
      "evidence_transition_preconditions": [
        "a future implemented GRBL service would require fresh boundary adjudication if it exposes a genuinely unowned lifecycle"
      ],
      "promotion_blockers": [
        "a named six-plane architecture does not itself create a distinct stack layer"
      ],
      "non_claims": [
        "does not forbid a future chapter if implementation reveals an unowned responsibility"
      ]
    }
  ],
  "validation_boundary": "Records a complete-manuscript existing-owner integration and rejects a duplicate chapter. It does not validate the propositions, conjectures, evaluator ecology, benchmark design, repair compiler, safety, novelty, or resource advantage.",
  "support_state_effect": "backlog_only",
  "non_claims": [
    "does not change chapter order",
    "does not add a Lean proof target",
    "does not claim the supplied manifest proves manuscript truth",
    "does not authorize training, deployment, release, or claim promotion"
  ]
}
